{
  "id": "paho-csp30r9-regionalgsstrategy-paha",
  "title": "Resolution CSP30.R9 Strategy on Regional Genomic Surveillance for Epidemic and Pandemic Preparedness and Response",
  "organization": "Pan American Health Organization (PAHO)",
  "description": "Regional strategy adopted December 2024 for enhancing genomic surveillance capabilities across Americas; mandates regional networks, capacity building, lab strengthening, data sharing, preparedness & response.",
  "url": "https://www.paho.org/en/documents/resolution-csp30r9-strategy-regional-genomic-surveillance-epidemic-and-pandemic",
  "audiences": [
    "laboratorians",
    "public-health-officials",
    "policymakers",
    "regional-international-orgs"
  ],
  "stages": [
    "planning-strategy"
  ],
  "types": [
    "policy-document",
    "guide-manual"
  ],
  "geography": [
    "americas",
    "global"
  ],
  "topics": [
    "regulatory-frameworks",
    "genomic-surveillance",
    "regional-networks",
    "resource-mobilization"
  ],
  "pathogenFocus": [],
  "language": [
    "en"
  ],
  "keyFeatures": [
    "The-res but focused on genomic surveillance; regional integration; mandates for networks & data sharing; resource mobilization"
  ],
  "practicalUse": "Aids countries in Americas & elsewhere to see what regional strategy & mandates look like; can provide model for regional pact / policy; helps stakeholders push for regional networks",
  "relatedResources": [],
  "lastUpdated": "",
  "formatDetails": "",
  "legacyTags": [],
  "validated": true
}
